"fct_ref","fct_citation","fct_location","fct_year","fct_desc","count","study_id","fct_id","ISO3","ISO2","NAME_ISO","NAME_FAO","NAME_LOCAL","SOVEREIGN","UNREGION1","UNREGION2","continent","fct_source"
"Joy et al., 2014","Joy, E.J.M., Ander, E.L., Young, S.D., Black, C.R., Watts, M.J., Chilimba, A.D.C., Chilima, B., Siyame, E.W.P., Kalimbira, A.A., Hurst, R., Fairweather-Tait, S.J., Stein, A.J., Gibson, R.S., White, P.J., Broadley, M.R., 2014. Dietary mineral supplies in Africa. Physiol Plantarum 151, 208–229. https://doi.org/10.1111/ppl.12144","Africa",2014,"Africa, regional NCT, 2014",1,"S0178","SF021",NA,NA,NA,NA,NA,NA,NA,NA,"Africa",NA
"NIH and FAO, 1966","Nutrition Section, Office of International Research and Food Consumption and Planning Branch, Nutrition Division, FAO, Rome. (1966) Selected Bibliography on African Foods and Nutrition and African Botanical Nomenclature, pp. 138. FAO, Rome","Africa",1966,"Africa FCT, 1966",1,"S0097","SF040",NA,NA,NA,NA,NA,NA,NA,NA,"Africa",NA
"Woot-Tsuen, 1968","Food and Agriculture Organization (1968). Food Composition Table for Use in Africa. Rome: FAO.","Africa",1968,"Africa FCT, 1968",19,"S0017;S0039;S0060;S0066;S0067;S0069;S0093;S0096;S0100;S0106;S0111;S0113;S0149;S0154;S0180;S0182;S0192;S0219;S0226","SF070",NA,NA,NA,NA,NA,NA,NA,NA,"Africa",NA
"Africa FCT, 1968",NA,"Africa",1968,"Food composition Table for Use in Africa WT Wu Leung, FAO, Rome, Italy; US Dept Health, Education, and Welfare, Bethesda, MD, USA - 1968* 306 pp (English); Food Composition Tables for Use in Africa, FAO, Rome, 1968",2,NA,"I0003; L0001",NA,NA,NA,NA,NA,NA,NA,NA,"Africa","infoods; langual"
"Africa FCT, 1993",NA,"Africa",1993,"Répertoire général des aliments 3: Table de composition des fruits exotiques, fruits de cueillette d'Afrique - J-C Favier, J Ireland-Ripert, C Laussucq, M Feinberg - Ciqual & CNEVA - 1993* 207 pp (French)",1,NA,"I0001",NA,NA,NA,NA,NA,NA,NA,NA,"Africa","infoods"
"Africa FCT, NA",NA,"Africa",NA,"Carte des Calories et des Vitamines pour 150 Aliments Africains - Office de Recherches sur l'Alimentation et la Nutrition Africaine (ORANA), 39, Avenue Pasteur, BP 2089, Dakar, Senegal - undated* poster, (French)",1,NA,"I0002",NA,NA,NA,NA,NA,NA,NA,NA,"Africa","infoods"
"NA","NA","Burkina Faso",NA,"Burkina Faso FCT, na",1,"S0190","SF033","BFA","BF","BURKINA FASO","Burkina Faso","Burkina Faso","Burkina Faso","Western Africa","Africa","Africa",NA
"Kouebou et al., 2013","NA","Cameroon",2013,"Cameroon FCT, 2013",1,"S0163","SF024","CMR","CM","CAMEROON","Cameroon","Cameroon","Cameroun","Middle Africa","Africa","Africa",NA
"Cameroon FCT, 1957",NA,"Cameroon",1957,"Table Provisoire de Composition des Aliments du Sud-Cameroun B Bergeret, R Masseyeff - Nutrition Section, Office de la Recherche Scientifique et Technique Outre-Mer, Yaoundé - Ann Nut Alim, Vol XI, pp 47-69 1957 (French)",1,NA,"I0011","CMR","CM","CAMEROON","Cameroon","Cameroon","Cameroun","Middle Africa","Africa","Africa","infoods"
"Cameroon FCT, 1966",NA,"Cameroon",1966,"Les Aliments d'Origine Végétale au Cameroun J Pele, S Le Berre - Nutrition Section, Office de la Recherche Scientifique et Technique Outre-Mer, Yaoundé 1966 (French)",1,NA,"I0010","CMR","CM","CAMEROON","Cameroon","Cameroon","Cameroun","Middle Africa","Africa","Africa","infoods"
"Democratic Republic of the Congo FCT, 1966",NA,"Democratic Republic of the Congo",1966,"Tables de composition alimentaire pour la République Démocratique du Congo VA Degroote Office National de la Recherche et du Developpement, BP 3119 Kinshasa-Kaslina (French) (1966)",1,NA,"I0012","COD","CD","CONGO, THE DEMOCRATIC REPUBLIC OF THE","Congo, Dem Republic of","République Démocratique du Congo|Zaire","The Democratic Republic of the Congo","Middle Africa","Africa","Africa","infoods"
"West, 1987","West CE, Pepping F, Scholte I, Jansen W, Albers HFF. Food composition table for foods commonly eaten in East Africa. Wageningen. Netherlands: CTA-ECSA. 1987","Eastern Africa",1987,"East Africa FCT, 1987",5,"S0066;S0068;S0093;S0100;S0152","SF067",NA,NA,NA,NA,NA,NA,"Eastern Africa","Africa","Africa",NA
"East Africa FCT, 1987",NA,"Eastern Africa",1987,"Food Composition Table for Energy and Eight Important Nutrients in Foods Commonly Eaten in East Africa CE West, F Pepping, I Scholte, W Jansen, HFF Albers Technical Centre for Agriculture and Rural Cooperation (CTA) of ACP/ECP, Tanzania",1,NA,"I0004",NA,NA,NA,NA,NA,NA,"Eastern Africa","Africa","Africa","infoods"
"Agren and Gibson, 1975","Agren, G., Gibson, R., 1975. Food Composition Table for Use in Ethiopia. Ethiopia, 31pp","Ethiopia",1975,"Ethiopia FCT, 1975",2,"S0100;S0215","SF002","ETH","ET","ETHIOPIA","Ethiopia","Ityop'iya","Ethiopia","Eastern Africa","Africa","Africa",NA
"EHNRI/FAO, 1998","EHNRI/FAO. Food composition table for use in Ethiopia. Part IV. Addis Ababa: Ethiopian Health and Nutrition Research Institute, 1998.","Ethiopia",1998,"Ethiopia FCT, 1998",8,"S0088;S0099-07;S0157;S0214;S0215;S0231;S0233;S0244","SF011","ETH","ET","ETHIOPIA","Ethiopia","Ityop'iya","Ethiopia","Eastern Africa","Africa","Africa",NA
"ENI, 1981","Ethiopian Nutrition Institute (ENI). Food Composition Table for use in Ethiopia. Part III. 1968–1997. Addis Ababa, Ethiopia: ENI, 1981.","Ethiopia",1981,"Ethiopia FCT, 1981",4,"S0099-07;S0157;S0215;S0231","SF012","ETH","ET","ETHIOPIA","Ethiopia","Ityop'iya","Ethiopia","Eastern Africa","Africa","Africa",NA
"Ethiopia FCT, 1981",NA,"Ethiopia",1981,"Expanded Food Composition Table for Use in Ethiopia - Ethiopian Nutrition Institute, Addis Ababa - undated* 73 pp (English); Ethiopian Nutrition Institute - Expanded Food Composition Table for use in Ethiopia, 1981",2,NA,"I0015; L0002","ETH","ET","ETHIOPIA","Ethiopia","Ityop'iya","Ethiopia","Eastern Africa","Africa","Africa","infoods; langual"
"Ethiopia FCT, 1968",NA,"Ethiopia",1968,"Food Composition Table for Use in Ethiopia I G Ågren, R Gibson - Swedish International Development Authority, Stockholm, and Ethiopian Nutrition Institute, Addis Ababa 1968* 31 pp(English)",1,NA,"I0017","ETH","ET","ETHIOPIA","Ethiopia","Ityop'iya","Ethiopia","Eastern Africa","Africa","Africa","infoods"
"Ethiopia FCT, 1975",NA,"Ethiopia",1975,"Food Composition Table for Use in Ethiopia II: Amino Acid Content and Biological Data on Proteins in Ethiopian Foods G Ågren, A Eklund, S-Å Liedén, Swedish International Development Authority, Stockholm, and Ethiopian Nutrition Institute, Addis Ababa - 1975* 72 pp(English)",1,NA,"I0016","ETH","ET","ETHIOPIA","Ethiopia","Ityop'iya","Ethiopia","Eastern Africa","Africa","Africa","infoods"
"Ethiopia FCT, 1998",NA,"Ethiopia",1998,"Food Composition Table for Use in Ethiopia IV * 33 pp (English) (1998)",1,NA,"I0014","ETH","ET","ETHIOPIA","Ethiopia","Ityop'iya","Ethiopia","Eastern Africa","Africa","Africa","infoods"
"Prynne and Paul, 2011","Prynne C & Paul A (2011) Food Composition Table for Use in The Gambia. Cambridge: Medical Research Council Human Nutrition Research","Gambia",2011,"Gambia FCT, 2011",1,"S0192","SF050","GMB","GM","GAMBIA","Gambia","The Gambia","Gambia","Western Africa","Africa","Africa",NA
"Gambia FCT, 2011",NA,"Gambia",2011,"Food Composition Table for use in The Gambia By C.J. Prynne and A.A. Paul - MRC Human Nutrition Research, Cambridge, UK Gail.Goldberg@ mrc-hnr.cam.ac.uk (2011); Food Composition Table for use in The Gambia (MRC Human Nutrition Research)",2,NA,"I0018; N0001","GMB","GM","GAMBIA","Gambia","The Gambia","Gambia","Western Africa","Africa","Africa","infoods; nutritool"
"Gambia FCT, 1979",NA,"Gambia",1979,"Foods of Rural Gambia JE McCrae, AA Paul - Medical Research Council Dunn Nutrition Unit, Cambridge, UK, and Keneba, The Gambia 1979* 89 pp(English)",1,NA,"I0021","GMB","GM","GAMBIA","Gambia","The Gambia","Gambia","Western Africa","Africa","Africa","infoods"
"Gambia FCT, 1987",NA,"Gambia",1987,"Gambian Foods: GAFNA Handbook no. 1. [energy and protein tables] [a nutrition guidebook for health workers] Gambian Food and Nutrition Association (GAFNA) with international agencies. Sent to us by Medical Research Council Dunn Nutrition Unit, Downhams Lane, Milton Road, Cambridge CB4 1XJ, England. No year, but says GAFNA formed 1987. 29 pp., 2 cc.(English, with Mandinka)",1,NA,"I0020","GMB","GM","GAMBIA","Gambia","The Gambia","Gambia","Western Africa","Africa","Africa","infoods"
"Gambia FCT, 1996",NA,"Gambia",1996,"Foods of Rural Gambia JE McCrae, AA Paul - Medical Research Council Dunn Nutrition Unit, Cambridge, UK, and Keneba, The Gambia, Second Edition, 1996* 109 pp(English)",1,NA,"I0019","GMB","GM","GAMBIA","Gambia","The Gambia","Gambia","Western Africa","Africa","Africa","infoods"
"Eyeson and Ankrah, 1975","Eyeson KK, Ankrah EK. Composition of foods commonly used in Ghana. Accra: Food Research Institute, 1975.","Ghana",1975,"Ghana FCT, 1975",2,"S0060;S0148","SF013","GHA","GH","GHANA","Ghana","Ghana","Ghana","Western Africa","Africa","Africa",NA
"NA","NA","Ghana",NA,"Ghana FCT, na",2,"S0147;S0160","SF034","GHA","GH","GHANA","Ghana","Ghana","Ghana","Western Africa","Africa","Africa",NA
"Ghana FCT, 1975",NA,"Ghana",1975,"Composition of Foods Commonly Used in Ghana KK Eyeson, EK Ankrah Food Research Institute (CSIR), and UNDP and FAO Food Research Institute, PO Box M20, Accra 1975* 57 pp (English)",1,NA,"I0023","GHA","GH","GHANA","Ghana","Ghana","Ghana","Western Africa","Africa","Africa","infoods"
"Ghana FCT, 1983",NA,"Ghana",1983,"Nutrient composition of 167 food items from Ghana, The Philippines, Italy and Finland - S Westenbrink, JT Knuiman, CE West, L van der Heijden, P van de Bovenkamp, EAM Koot-Gronsveld, JG Kosmeijer-Schuil, MB Katan Vol III of Food Analyses of the Department of Human Nutrition Department of Human Nutrition, Agricultural University, De Dreijen 12, 6703 BC Wageningen, The Netherlands 1983* 27 pp (English)",1,NA,"I0022","GHA","GH","GHANA","Ghana","Ghana","Ghana","Western Africa","Africa","Africa","infoods"
"FAO and MoH of Kenya, 2018","FAO. 2018. Kenya Food Composition Table 2018. The Food and Agriculture Organization of the United Nations/Government of Kenya","Kenya",2018,"Kenya FCT, 2018",1,"S0236","SF014","KEN","KE","KENYA","Kenya","Kenya","Kenya","Eastern Africa","Africa","Africa",NA
"Sehmi, 1993","Sehmi, J.K., 1993. National Food Composition Tables and the Planning of Satisfactory Diets in Kenya. Ministry of Health, Nairobi, Kenya.","Kenya",1993,"Kenya FCT, 1993",2,"S0094;S0181","SF053","KEN","KE","KENYA","Kenya","Kenya","Kenya","Eastern Africa","Africa","Africa",NA
"Kenya FCT, 2018",NA,"Kenya",2018,"Kenya Food Composition Tables 2018; Kenya Food Composition Tables 2018",2,NA,"I0024; L0003","KEN","KE","KENYA","Kenya","Kenya","Kenya","Eastern Africa","Africa","Africa","infoods; langual"
"Kenya FCT, 1951",NA,"Kenya",1951,"Chemical Composition of Some Kenya Foodstuffs D Harvey Records of the Medical Research Laboratory No 10, Medical Department Government Printer, Nairobi, 1951 (English)",1,NA,"I0027","KEN","KE","KENYA","Kenya","Kenya","Kenya","Eastern Africa","Africa","Africa","infoods"
"Kenya FCT, 1993",NA,"Kenya",1993,"National Food Composition Tables and The Planning of Satisfactory Diets in Kenya *, Dr. (Mrs.) Jaswant Kaur Sehmi (autographed)Ministry of Health.Government Printer, P.O. Box 30128, Nairobi, Kenya.1993*, 200 pp. (English)",1,NA,"I0026","KEN","KE","KENYA","Kenya","Kenya","Kenya","Eastern Africa","Africa","Africa","infoods"
"Watts et al., 2019","Watts, M.J., Middleton, D.R.S., Marriott, A.L., Humphrey, O.S., Hamilton, E.M., Gardner, A., Smith, M., McCormack, V.A., Menya, D., Munishi, M.O., Mmbaga, B.T., Osano, O., 2019. Source apportionment of micronutrients in the diets of Kilimanjaro,Tanzania and Counties of Western Kenya. Scientific reports 9, 14447–14447. https://doi.org/10.1038/s41598-019-51075-2","Kenya, Western",2019,"Tanzania, Kilimanjaro NCT, 2019; Kenya, Western NCT, 2019",1,"S0234","SF065","KEN","KE","KENYA","Kenya","Kenya","Kenya","Eastern Africa","Africa","Africa",NA
"Lephole et al, 2006","Lephole M, Khaketla M & Monoto M (2006) Lesotho Food Composition Table. Maseru: Department of Agricultural Research","Lesotho",2006,"Lesotho FCT, 2006",2,"S0137;S0192","SF027","LSO","LS","LESOTHO","Lesotho","Lesotho","Lesotho","Southern Africa","Africa","Africa",NA
"Lesotho FCT, 2006",NA,"Lesotho",2006,"Lesotho Food Composition Table (2006) (Excel version) ",1,NA,"I0028","LSO","LS","LESOTHO","Lesotho","Lesotho","Lesotho","Southern Africa","Africa","Africa","infoods"
"NA","NA","Madagascar",NA,"Madagascar FCT, na",1,"S0223","SF036","MDG","MG","MADAGASCAR","Madagascar","Madagascar","Madagascar","Eastern Africa","Africa","Africa",NA
"Ferguson, 1992","Ferguson E L. (1992). A comparison of the seasonal food consumption patterns and zinc status of preschool children living in rural areas of Southern Malawi and Southern Ghana. PhD Thesis, University of Guelph.","Malawi",1992,"Malawi FCT, 1992",4,"S0077;S0102;S0158;S0224","SF015","MWI","MW","MALAWI","Malawi","Malawi","Malawi","Eastern Africa","Africa","Africa",NA
"Joy et al., 2015","Joy, E.J.M., Broadley, M.R., Young, S.D., Black, C.R., Chilimba, A.D.C., Ander, E.L., Barlow, T.S., Watts, M.J., 2015. Soil type influences crop mineral composition in Malawi. Science of the Total Environment 505, 587–595. https://doi.org/10.1016/j.scitotenv.2014.10.038","Malawi",2015,"NA",1,"S0184","SF022","MWI","MW","MALAWI","Malawi","Malawi","Malawi","Eastern Africa","Africa","Africa",NA
"Malawi FCT, 2019",NA,"Malawi",2019,"MAFOODS. 2019. Malawian Food Composition Table. 1st Editionhttps://dl.tufts.edu/downloads/g158bw806?filename=d217r336d.pdf Averalda van Graan, Joelaine Chetty, Malory Jumat, Sitilitha Masangwi, Agnes Mwangwela, Felix Pensulo Phiri, Lynne M. Ausman, Shibani Ghosh, Elizabeth Marino-Costello (Eds). Lilongwe, Malawi..; MAFOODS. 2019. Malawian Food Composition Table. 1st Edition. Averalda van Graan, Joelaine Chetty, Malory Jumat, Sitilitha Masangwi, Agnes Mwangwela, Felix Pensulo Phiri, Lynne M. Ausman, Shibani Ghosh, Elizabeth Marino-Costello (Eds). Lilongwe, Malawi.",2,NA,"I0029; L0004","MWI","MW","MALAWI","Malawi","Malawi","Malawi","Eastern Africa","Africa","Africa","infoods; langual"
"a-TACAM, 2015","NA","Mali",2015,"Mali FCT, 2015",2,"S0188;S0210","SF001","MLI","ML","MALI","Mali","Mali","Mali","Western Africa","Africa","Africa",NA
"Barikmo et al., 2004","Barikmo, I., Ouattara, F., Oshaug, A., 2004b. Table de Composition d’aliments du Mali. Akershus University College. Research Series. Lillestrøm, Norway","Mali",2004,"Mali FCT, 2004",2,"S0101;S0130","SF003","MLI","ML","MALI","Mali","Mali","Mali","Western Africa","Africa","Africa",NA
"Nordeide et al., 1995","Nordeide, Marit Beseth, Oshaug, Arne, Holm, Halvor. (1995). Nutrient Composition of Wild-Gathered Foods from Mali","Mali",1995,"Mali FCT, 1995",1,"S0062","SF041","MLI","ML","MALI","Mali","Mali","Mali","Western Africa","Africa","Africa",NA
"Nordeide, 1997","Nordeide MB. Table de Composition d'Aliments du Mali.Annex No. 9. Rapport d'Etape SeÂcuriteÂ Alimentaire/Femme. Projet de Recherche SSE. Environnement et DeÂveloppement au Mali. Oslo: CNRST/UniversiteÂ d'Oslo, 1997.","Mali",1997,"Mali FCT, 1997",2,"S0081;S0100","SF042","MLI","ML","MALI","Mali","Mali","Mali","Western Africa","Africa","Africa",NA
"Mali FCT, 1995",NA,"Mali",1995,"The Composition of Malian Foods - M B Nordeide, CNRST, Programme de Recherche SSE - Bamako, Mali & Nordic School of Nutrition, University of Oslo, Norway 1995 Draft (English)",1,NA,"I0031","MLI","ML","MALI","Mali","Mali","Mali","Western Africa","Africa","Africa","infoods"
"Mali FCT, 1998",NA,"Mali",1998,"Table de composition d'aliments du Mali - M B Nordeide, Projet de Recherche SSE, Environnement et Developpement au Mali, Mali/Norvege 1998 (French)",1,NA,"I0030","MLI","ML","MALI","Mali","Mali","Mali","Western Africa","Africa","Africa","infoods"
"Korkalo et al., 2011","Korkalo L, Hauta-alus H, Mutanen M. Food Composition Tables for Mozambique. Helsinki, Finland; 2011","Mozambique",2011,"Mozambique FCT, 2011",6,"S0182;S0192;S0219;S0221;S0241;S0250","SF023","MOZ","MZ","MOZAMBIQUE","Mozambique","Mocambique","Mozambique","Eastern Africa","Africa","Africa",NA
"Mozambique FCT, 2011",NA,"Mozambique",2011,"Food composition database for Mozambique, Version 2 (2011) Korkalo L, Hauta-alus H, Mutanen M - Department of Food and Environmental Sciences. University of Helsinki, Finland. The table includes 205 foods and 35 nutrients Actual and Recommended Diet Make-up for the Population of Mozambique, including Food Composition Table; University of Helsinki, Department of Food and Environmental Sciences - Food Composition Table for Mozambique",2,NA,"I0032; L0005","MOZ","MZ","MOZAMBIQUE","Mozambique","Mocambique","Mozambique","Eastern Africa","Africa","Africa","infoods; langual"
"Mozambique FCT, 1985",NA,"Mozambique",1985,"Actual and Recommended Diet Make-up for the Population of Mozambique, including Food Composition Table - FL Snijders - Série Terra e Água do Instituto Nacional de Investigação - Agronómica, Documento Interno No 10, Maputo 1985 16 pp (English)",1,NA,"I0033","MOZ","MZ","MOZAMBIQUE","Mozambique","Mocambique","Mozambique","Eastern Africa","Africa","Africa","infoods"
"Oguntona and Akinyele, 1995","Oguntona, E.B., Akinyele, I.O., 1995. Nutrient Composition of Commonly Eaten Foods in Nigeria—Raw, Processed and Prepared. Food Basket Foundation Publication Series, Nigeria, 131pp","Nigeria",1995,"Nigeria FCT, 1995",6,"S0100;S0111;S0120;S0136;S0154;S0155","SF045","NGA","NG","NIGERIA","Nigeria","Nigeria","Nigeria","Western Africa","Africa","Africa",NA
"Osagie and Eka, 1998","Osagie, A.U., Eka, O.U. (Eds.), 1998. Nutritional Quality of Plants. Post Harvest Research Unit, University of Benin, Benin City.","Nigeria",1998,"Nigeria FCT, 1998",1,"S0111","SF046","NGA","NG","NIGERIA","Nigeria","Nigeria","Nigeria","Western Africa","Africa","Africa",NA
"Oyenuga, 1968","Oyenuga, V.A.(1968). Nigeria’s Foods and Feeding Stuff: Their Chemistry and Nutritive Values (p. 99),Ibadan University Press,Ibadan.","Nigeria",1968,"Nigeria FCT, 1968",1,"S0154","SF047","NGA","NG","NIGERIA","Nigeria","Nigeria","Nigeria","Western Africa","Africa","Africa",NA
"Nigeria FCT, 2019",NA,"Nigeria",2019,"Nigeria Food Database 2019; Nigeria Food Database",2,NA,"I0034; L0006","NGA","NG","NIGERIA","Nigeria","Nigeria","Nigeria","Western Africa","Africa","Africa","infoods; langual"
"Nigeria FCT, 1968",NA,"Nigeria",1968,"Nigerian Foods and Feedingstuffs - VA Oyenuya University Press, Ivadan 1968 (English)",1,NA,"I0036","NGA","NG","NIGERIA","Nigeria","Nigeria","Nigeria","Western Africa","Africa","Africa","infoods"
"Nigeria FCT, 1995",NA,"Nigeria",1995,"Nutrient Composition of Commonly Eaten Foods in Nigeria - Raw, processed and prepared-1995 131 pp (English) - EB Oguntona & IO Akinyele - Food Basket Foundation Publication Series 1995 131 pp (English). Contact: Executive Chairman, Food Basket Foundation International, 46 Ondo Street, Old Bodija Estate, Ibadan, Oyo State Nigeria",1,NA,"I0035","NGA","NG","NIGERIA","Nigeria","Nigeria","Nigeria","Western Africa","Africa","Africa","infoods"
"Yoo et al., 2019","Yoo, Y.M., Atkin, R.A., Pachón, H., 2019. Short Communication: Development of a food composition table to analyze Senegalese food expenditure data. African Journal of Food, Agriculture, Nutrition and Development 19.","Senegal",2019,"Senegal NCT, 2019,",1,"S0235","SF071","SEN","SN","SENEGAL","Senegal","Senegal","Senegal","Western Africa","Africa","Africa",NA
"Senegal FCT, 1961",NA,"Senegal",1961,"Chemical Composition of 66 Samples of Leaves, Fruits, Seeds and Tubercles Eaten in Senegal -Qualitas Plantarum et Materiae, Vol 8, No 2, pp 139-155, The Hague, Netherlands 16 pp (English) (1961)",1,NA,"I0037","SEN","SN","SENEGAL","Senegal","Senegal","Senegal","Western Africa","Africa","Africa","infoods"
"Gouws and Langenhoven, 1981","Gouws E, Langenhoven ML. NRIND Food Composilion Tables 1981. Parow, CP: South African Medical Research Council, 1982","South Africa",1987,"South Africa, 1987",1,"S0031","SF017","ZAF","ZA","SOUTH AFRICA","South Africa","South Africa","South Africa","Southern Africa","Africa","Africa",NA
"Langenhoven, et al., 1991","Langenhoven, M., Kruger, M., Gows, E., Faber, M., 1991. MRC Food Composition Tables, 3rd Edition. Medical ResearchCouncil, Tygerberg, SouthAfrica","South Africa",1993,"South Africa, 1993",1,"S0093","SF026","ZAF","ZA","SOUTH AFRICA","South Africa","South Africa","South Africa","Southern Africa","Africa","Africa",NA
"Mamvul-a, 1982","Mamvul'a, C.B., (1982), Shona Foods Composition Tables, Salisbury, Longmans (in print).","South Africa",1982,"Shona FCT, 1982",1,"S0026","SF029","ZAF","ZA","SOUTH AFRICA","South Africa","South Africa","South Africa","Southern Africa","Africa","Africa",NA
"NA","NA","South Africa",2003,"MRC Food Composition Tables of South Africa, 2003",1,"S0093","SF037","ZAF","ZA","SOUTH AFRICA","South Africa","South Africa","South Africa","Southern Africa","Africa","Africa",NA
"NA","NA","South Africa",NA,"RSA food composition tables",2,"S0126;S0142","SF038","ZAF","ZA","SOUTH AFRICA","South Africa","South Africa","South Africa","Southern Africa","Africa","Africa",NA
"SAFOODS, 2017","SAFOODS (2017). SAMRC Food Composition Tables for South Africa (5th ed.). Cape Town: South African Medical Research Council.","South Africa",2017,"South Africa FCT, 2017",1,"S0239","SF051","ZAF","ZA","SOUTH AFRICA","South Africa","South Africa","South Africa","Southern Africa","Africa","Africa",NA
"Wolmarans et al, 1992","WOLMARANS P, LANGENHOVEN M and FABER, M (1992) Food: Facts and Figures, the Complete South African Guide. Oxford University Press, Cape Town. 135 pp.","South Africa",1992,"South Africa FCT, 1992",1,"S0107","SF068","ZAF","ZA","SOUTH AFRICA","South Africa","South Africa","South Africa","Southern Africa","Africa","Africa",NA
"Wolmarans et al, 2010","Wolmarans, P., Danster, N., Dalton, A., Rossouw, K., & Schönfeldt, H. (2010). Condensed food composition tables for South Africa. Cape Town: Medical Research Council","South Africa",2010,"South Africa FCT, 2010",1,"S0232","SF069","ZAF","ZA","SOUTH AFRICA","South Africa","South Africa","South Africa","Southern Africa","Africa","Africa",NA
"South Africa FCT, 2018",NA,"South Africa",2018,"SAFOODS website; SAFOODS - South African Food Data System; South African dataset (Schönfeldt & Pretorius, 2018) (in EuroFIR FoodEXplorer)",3,NA,"I0038; L0007; L0008","ZAF","ZA","SOUTH AFRICA","South Africa","South Africa","South Africa","Southern Africa","Africa","Africa","infoods; langual; langual"
"Kulwa et al., 2015","Kulwa, K.B.M., Mamiro, P.S., Kimanya, M.E., Mziray, R., Kolsteren, P.W., 2015. Feeding practices and nutrient content of complementary meals in rural central Tanzania: implications for dietary adequacy and nutritional status. BMC Pediatr 15, 171. https://doi.org/10.1186/s12887-015-0489-2","Tanzania",2015,"Tanzania FCD, 2015",1,"S0187","SF025","TZA","TZ","TANZANIA, UNITED REPUBLIC OF","Tanzania, United Rep of","Tanzania","Tanzania","Eastern Africa","Africa","Africa",NA
"Lukmanji et al., 2008","Lukmanji, Z., Hertzmark, E., Mlingi, N., Assey, V., Ndossi, G. and Fawzi, W. (2008) Tanzania food composition tables. Muhimbili University College of Health and Allied Sciences; Tanzania Food and Nu trition Center; Harvard School of Public Health, Dar es Salaam, Tanzania.","Tanzania",2008,"Tanzania FCT, 2008",6,"S0144;S0192;S0195;S0220;S0224;S0250","SF028","TZA","TZ","TANZANIA, UNITED REPUBLIC OF","Tanzania, United Rep of","Tanzania","Tanzania","Eastern Africa","Africa","Africa",NA
"Tanzania FCT, 2008",NA,"Tanzania",2008,"Tanzania Food Composition Tables (English) (2008) - Zohra Lukmanji AND Ellen Hertzmark, Nicolas Mlingi, Vincent Assey, Godwin Ndossi, Wafaie Fawzi - Muhimbili University of Health and Allied Sciences (MUHAS), Dar es Salaam - Tanzania and Tanzania Food and Nutrition Centre (TFNC), Dar es Salaam - Tanzania and Harvard School of Public Health (HSPH), Boston, USA. 2008 (English); Tanzania Food Composition Tables",2,NA,"I0041; L0009","TZA","TZ","TANZANIA, UNITED REPUBLIC OF","Tanzania, United Rep of","Tanzania","Tanzania","Eastern Africa","Africa","Africa","infoods; langual"
"Tanzania FCT, 1974",NA,"Tanzania",1974,"The Tanzania Food Tables - ALD Marealle, East Africa Literature Bureau 1974 (Kiswahili)",1,NA,"I0044","TZA","TZ","TANZANIA, UNITED REPUBLIC OF","Tanzania, United Rep of","Tanzania","Tanzania","Eastern Africa","Africa","Africa","infoods"
"Tanzania FCT, 1985",NA,"Tanzania",1985,"Food Composition Table for Use in a Research Program on Vitamin A Deficiency in Tanzania - CE West, ed, Agricultural University, Wageningen, Netherlands, and Tanzanian Food and Nutrition Centre, Dar es Salaam, Tanzania 1985* vii + 41 pp (English)",1,NA,"I0043","TZA","TZ","TANZANIA, UNITED REPUBLIC OF","Tanzania, United Rep of","Tanzania","Tanzania","Eastern Africa","Africa","Africa","infoods"
"Tanzania FCT, 1988",NA,"Tanzania",1988,"The Composition of Foods Commonly Eaten in East Africa - CE West, F Pepping, and CR Temalilawa, eds. Department of Human Nutrition, Wageningen Agricultural University, PO Box 8129, 6700 EV Wageningen, The Netherlands; Tanzania Food and Nutrition Centre, Box 977, Dar es Salaam, Tanzania 1988 (English)",1,NA,"I0042","TZA","TZ","TANZANIA, UNITED REPUBLIC OF","Tanzania, United Rep of","Tanzania","Tanzania","Eastern Africa","Africa","Africa","infoods"
"Watts et al., 2019","Watts, M.J., Middleton, D.R.S., Marriott, A.L., Humphrey, O.S., Hamilton, E.M., Gardner, A., Smith, M., McCormack, V.A., Menya, D., Munishi, M.O., Mmbaga, B.T., Osano, O., 2019. Source apportionment of micronutrients in the diets of Kilimanjaro,Tanzania and Counties of Western Kenya. Scientific reports 9, 14447–14447. https://doi.org/10.1038/s41598-019-51075-2","Tanzania, Kilimanjaro",2019,"Tanzania, Kilimanjaro NCT, 2019; Kenya, Western NCT, 2019",1,"S0234","SF066","TZA","TZ","TANZANIA, UNITED REPUBLIC OF","Tanzania, United Rep of","Tanzania","Tanzania","Eastern Africa","Africa","Africa",NA
